{
  "schemaVersion": "research_claim_ledger_v1",
  "ledgerId": "tnm-dossier-pilot-20260809-claim-ledger",
  "runId": "tnm-dossier-pilot-20260809",
  "createdAt": "2026-08-09T23:31:31.109Z",
  "completedAt": "2026-08-10T08:14:18.000Z",
  "status": "complete",
  "claims": [
    {
      "claimId": "claim-shift-coastal-technologies-1-20260809",
      "subjectId": "subject-shift-coastal-technologies",
      "subjectType": "organization",
      "predicate": "Shift Coastal Technologies operates in the documented delivery role",
      "value": "Shift works as an integration and sustainment partner for government, defence, research and commercial marine operators, combining autonomous surface and subsea platforms with payloads, communications, edge compute, command software, field deployment and lifecycle support. Its public record emphasizes interoperable system delivery rather than a single proprietary vehicle.",
      "unit": null,
      "material": true,
      "temporal": {
        "observedAt": "2026-08-10T08:14:18.000Z",
        "publishedAt": null,
        "effectiveFrom": null,
        "effectiveTo": null
      },
      "source": {
        "sourceId": "source-shift-official-20260809",
        "originalUrl": "https://shiftcoastaltechnologies.com/",
        "canonicalUrl": "https://shiftcoastaltechnologies.com/",
        "locator": "Company profile, capabilities, partner network and contact section",
        "sourceChannel": "official_company",
        "sourceFamily": "shift-coastal-technologies-shift-coastal-technologies-autonomous-ma",
        "sourcePosture": "evidence_anchor",
        "independenceKey": "shiftcoastaltechnologies.com|source-shift-official-20260809"
      },
      "status": "supported",
      "independentClaimIds": [],
      "contradictsClaimIds": [],
      "supersedesClaimIds": [],
      "disposition": "candidate_field",
      "candidateTargets": [
        {
          "candidateId": "candidate-shift-coastal-technologies-editorial-v1-20260809",
          "fieldPath": "operations.set-operating-context.after.value",
          "operationId": "set-operating-context"
        }
      ],
      "analystNote": "Shift Coastal Technologies' Company profile, capabilities, partner network and contact section supports after for Shift Coastal Technologies: Shift works as an integration and sustainment partner for government, defence, research and commercial marine operators, combining autonomous surface and subsea platforms with payloads, communications, edge compute, command software, field deployment and lifecycle support. The reviewer must compare this exact excerpt with the proposed leaf before any decision."
    },
    {
      "claimId": "claim-shift-coastal-technologies-2-20260809",
      "subjectId": "subject-shift-coastal-technologies",
      "subjectType": "organization",
      "predicate": "Shift Coastal Technologies maintains the documented Canadian footprint",
      "value": "Shift publishes its Nanaimo, British Columbia operating address and describes its Canadian marine-autonomy integration and deployment role.",
      "unit": null,
      "material": true,
      "temporal": {
        "observedAt": "2026-08-10T08:14:18.000Z",
        "publishedAt": null,
        "effectiveFrom": null,
        "effectiveTo": null
      },
      "source": {
        "sourceId": "source-shift-official-20260809",
        "originalUrl": "https://shiftcoastaltechnologies.com/",
        "canonicalUrl": "https://shiftcoastaltechnologies.com/",
        "locator": "Company profile, capabilities, partner network and contact section",
        "sourceChannel": "official_company",
        "sourceFamily": "shift-coastal-technologies-shift-coastal-technologies-autonomous-ma",
        "sourcePosture": "evidence_anchor",
        "independenceKey": "shiftcoastaltechnologies.com|source-shift-official-20260809"
      },
      "status": "supported",
      "independentClaimIds": [],
      "contradictsClaimIds": [],
      "supersedesClaimIds": [],
      "disposition": "candidate_field",
      "candidateTargets": [
        {
          "candidateId": "candidate-shift-coastal-technologies-editorial-v1-20260809",
          "fieldPath": "operations.set-canadian-footprint.after.value",
          "operationId": "set-canadian-footprint"
        }
      ],
      "analystNote": "Shift Coastal Technologies' Company profile, capabilities, partner network and contact section supports after for Shift Coastal Technologies: Shift publishes its Nanaimo, British Columbia operating address and describes its Canadian marine-autonomy integration and deployment role. The reviewer must compare this exact excerpt with the proposed leaf before any decision."
    },
    {
      "claimId": "claim-shift-coastal-technologies-3-20260809",
      "subjectId": "subject-shift-coastal-technologies",
      "subjectType": "organization",
      "predicate": "Shift Coastal Technologies maintains the documented Canadian footprint",
      "value": "CanadaBuys records Shift as the supplier on a Department of National Defence OceanSled Ranger testing-stream contract.",
      "unit": null,
      "material": true,
      "temporal": {
        "observedAt": "2026-08-10T08:14:18.000Z",
        "publishedAt": "2026-04-20T00:00:00.000Z",
        "effectiveFrom": "2026-04-20T00:00:00.000Z",
        "effectiveTo": null
      },
      "source": {
        "sourceId": "source-shift-dnd-contract-20260809",
        "originalUrl": "https://canadabuys.canada.ca/en/tender-opportunities/contract-history/cw2445771-000",
        "canonicalUrl": "https://canadabuys.canada.ca/en/tender-opportunities/contract-history/cw2445771-000",
        "locator": "Award date, buyer, supplier, value and contract period",
        "sourceChannel": "government_procurement",
        "sourceFamily": "canadabuys-as-188-oceansled-ranger-contract-history",
        "sourcePosture": "evidence_anchor",
        "independenceKey": "canadabuys.canada.ca|source-shift-dnd-contract-20260809"
      },
      "status": "supported",
      "independentClaimIds": [],
      "contradictsClaimIds": [],
      "supersedesClaimIds": [],
      "disposition": "candidate_field",
      "candidateTargets": [
        {
          "candidateId": "candidate-shift-coastal-technologies-editorial-v1-20260809",
          "fieldPath": "operations.set-canadian-footprint.after.value",
          "operationId": "set-canadian-footprint"
        }
      ],
      "analystNote": "CanadaBuys' Award date, buyer, supplier, value and contract period supports after for Shift Coastal Technologies: CanadaBuys records Shift as the supplier on a Department of National Defence OceanSled Ranger testing-stream contract. The reviewer must compare this exact excerpt with the proposed leaf before any decision."
    },
    {
      "claimId": "claim-shift-coastal-technologies-4-20260809",
      "subjectId": "subject-shift-coastal-technologies",
      "subjectType": "organization",
      "predicate": "Shift Coastal Technologies maintains the documented Canadian footprint",
      "value": "The Canadian Coast Guard records collaboration, testing and deployment involving an autonomous surface vessel.",
      "unit": null,
      "material": true,
      "temporal": {
        "observedAt": "2026-08-10T08:14:18.000Z",
        "publishedAt": null,
        "effectiveFrom": null,
        "effectiveTo": null
      },
      "source": {
        "sourceId": "source-shift-ccg-plan-20260809",
        "originalUrl": "https://www.canada.ca/en/canadian-coast-guard/corporate/publications/integrated-business-human-resource-plan-2025-2026-update.html",
        "canonicalUrl": "https://www.canada.ca/en/canadian-coast-guard/corporate/publications/integrated-business-human-resource-plan-2025-2026-update.html",
        "locator": "Autonomous surface vessel collaboration and Haida Gwaii deployment",
        "sourceChannel": "ecosystem_program",
        "sourceFamily": "canadian-coast-guard-canadian-coast-guard-integrated-business",
        "sourcePosture": "evidence_anchor",
        "independenceKey": "www.canada.ca|source-shift-ccg-plan-20260809"
      },
      "status": "supported",
      "independentClaimIds": [],
      "contradictsClaimIds": [],
      "supersedesClaimIds": [],
      "disposition": "candidate_field",
      "candidateTargets": [
        {
          "candidateId": "candidate-shift-coastal-technologies-editorial-v1-20260809",
          "fieldPath": "operations.set-canadian-footprint.after.value",
          "operationId": "set-canadian-footprint"
        }
      ],
      "analystNote": "Canadian Coast Guard's Autonomous surface vessel collaboration and Haida Gwaii deployment supports after for Shift Coastal Technologies: The Canadian Coast Guard records collaboration, testing and deployment involving an autonomous surface vessel. The reviewer must compare this exact excerpt with the proposed leaf before any decision."
    },
    {
      "claimId": "claim-shift-coastal-technologies-5-20260809",
      "subjectId": "subject-shift-coastal-technologies",
      "subjectType": "organization",
      "predicate": "Shift Coastal Technologies publishes the documented contactPageUrl",
      "value": "The official public contact pathway for Shift Coastal Technologies is https://shiftcoastaltechnologies.com/.",
      "unit": null,
      "material": true,
      "temporal": {
        "observedAt": "2026-08-10T08:14:18.000Z",
        "publishedAt": null,
        "effectiveFrom": null,
        "effectiveTo": null
      },
      "source": {
        "sourceId": "source-shift-official-20260809",
        "originalUrl": "https://shiftcoastaltechnologies.com/",
        "canonicalUrl": "https://shiftcoastaltechnologies.com/",
        "locator": "Company profile, capabilities, partner network and contact section",
        "sourceChannel": "official_company",
        "sourceFamily": "shift-coastal-technologies-shift-coastal-technologies-autonomous-ma",
        "sourcePosture": "evidence_anchor",